{
  "$schema": "../../templates/tokens.schema.json",
  "name": "Star Race",
  "version": "1",
  "locked": "2026-09-22",
  "derived-from": "white-cube@2",
  "color": {
    "bg": "#efeff1",
    "sheet": "#fff",
    "sunk": "#f5f5f7",
    "sunk2": "#ebebee",
    "ink": "#111114",
    "ink2": "#62656b",
    "ink3": "#9c9fa6",
    "hair": "#e9e9ec",
    "live": "#2eb87f",
    "warn-ink": "#8a2f22",
    "warn-bg": "#fbecea",
    "gold": "#E9B93A"
  },
  "radius": {
    "lg": "30px",
    "md": "22px",
    "sm": "14px",
    "pill": "999px"
  },
  "shadow": {
    "sh1": "0 1px 2px rgba(17,17,20,.04), 0 3px 10px -5px rgba(17,17,20,.08)",
    "sh2": "0 2px 4px rgba(17,17,20,.03), 0 22px 48px -24px rgba(17,17,20,.22)",
    "sh3": "0 1px 1px rgba(17,17,20,.05), 0 8px 20px -10px rgba(17,17,20,.22)"
  },
  "font": {
    "ui": "\"Instrument Sans\",system-ui,-apple-system,\"Segoe UI\",Roboto,sans-serif",
    "mono": "\"DM Mono\",ui-monospace,SFMono-Regular,Menlo,Consolas,monospace",
    "google": "https://fonts.googleapis.com/css2?family=Instrument+Sans:wght@400;500;600;700&family=DM+Mono:wght@300;400;500&display=swap"
  },
  "motion": {
    "ease": "cubic-bezier(.22,1,.36,1)",
    "spring": "cubic-bezier(.34,1.56,.64,1)"
  },
  "content": {
    "pieces": {
      "coral": "#F4776A",
      "tangerine": "#F59A3E",
      "jade": "#3E9C63",
      "teal": "#2FB5AB",
      "sky": "#4FA3E3",
      "indigo": "#5D6BE0",
      "violet": "#9C6BDD",
      "rose": "#E877B0",
      "cocoa": "#A6714E",
      "strip": "#F0C33C"
    },
    "players": [
      "#5D6BE0",
      "#F4776A",
      "#2FB5AB",
      "#9C6BDD"
    ]
  },
  "deltas": [
    "gold is game state, never a control",
    "icon circles 44px not 40",
    "no filled button while a board is in play",
    "countdown before the server clock starts"
  ]
}
